{
  "schema_version": "course-package/v1",
  "package_id": "pkg-dayu-flood-control",
  "course_id": "C-early-civilization",
  "lesson_id": "dayu-flood-control",
  "content_version": 1,
  "status": "sealed",
  "title": "大禹治水（技术样板）",
  "unit": "文明起源与早期国家",
  "era": "传说时代",
  "body": [
    "【教师待审】本段仅用于验证课程发布与关卡运行链路，正式课文由教师团队替换。",
    "【教师待审】样板围绕治水方法、公共动员和部族协作组织可计算的历史局势。"
  ],
  "abstract": "大禹治水端到端技术样板，内容结论均等待教师审校。",
  "course_title": "",
  "era_id": "content",
  "section": "内容包",
  "lesson_no": "",
  "duration": "",
  "teaching_objectives": [
    "理解治水方案需要同时考虑工程方法、资源和公共协作。",
    "能够依据状态变化解释一次选择的收益与代价。"
  ],
  "keywords": [
    {
      "keyword_id": "keyword-flood-control",
      "word": "治水",
      "pinyin": "",
      "gloss": "【教师待审】组织应对水患的工程与社会行动。",
      "source_ref_ids": [
        "source-dayu-placeholder"
      ]
    },
    {
      "keyword_id": "keyword-cooperation",
      "word": "部族协作",
      "pinyin": "",
      "gloss": "【教师待审】不同群体围绕共同目标进行资源与行动协调。",
      "source_ref_ids": [
        "source-dayu-placeholder"
      ]
    }
  ],
  "people": [
    {
      "person_id": "person-yu",
      "name": "禹",
      "role": "治水行动的主导者",
      "summary": "",
      "persona": "【教师待审】强调实地勘察、长期坚持和方法调整。",
      "boundaries": [
        "不得把传说细节表述成无争议的考古定论。"
      ],
      "fact_refs": [
        "fact-flood-method"
      ],
      "source_ref_ids": [
        "source-dayu-placeholder"
      ]
    },
    {
      "person_id": "person-people-representative",
      "name": "百姓代表",
      "role": "表达劳役与生计压力",
      "summary": "",
      "persona": "",
      "boundaries": [
        "只表达样板设定中的群体处境，不虚构具体史料引文。"
      ],
      "fact_refs": [
        "fact-public-mobilization"
      ],
      "source_ref_ids": [
        "source-dayu-placeholder"
      ]
    },
    {
      "person_id": "person-tribe-leader",
      "name": "部族首领",
      "role": "表达协作与资源分配压力",
      "summary": "",
      "persona": "",
      "boundaries": [
        "不得使用后世国家制度概念替代当时语境。"
      ],
      "fact_refs": [
        "fact-cooperation"
      ],
      "source_ref_ids": [
        "source-dayu-placeholder"
      ]
    },
    {
      "person_id": "person-artisan",
      "name": "水利工匠",
      "role": "解释地势、河道与工程取舍",
      "summary": "",
      "persona": "",
      "boundaries": [
        "工程解释必须标注为教学模型，不伪装成出土原话。"
      ],
      "fact_refs": [
        "fact-flood-method"
      ],
      "source_ref_ids": [
        "source-dayu-placeholder"
      ]
    }
  ],
  "map_points": [
    {
      "point_id": "map-yellow-river-middle",
      "label": "黄河中游技术样板点",
      "region": "黄河中游",
      "lat": null,
      "lng": null,
      "note": "【教师待审】仅作地图与状态引擎联调，不代表精确历史坐标。",
      "kind": "teaching-placeholder"
    }
  ],
  "facts": [
    {
      "fact_id": "fact-flood-method",
      "statement": "【教师待审】关卡需要区分短期堵水与勘察疏导的工程后果。",
      "source_ref_ids": [
        "source-dayu-placeholder"
      ],
      "certainty": "interpretation",
      "teacher_note": ""
    },
    {
      "fact_id": "fact-public-mobilization",
      "statement": "【教师待审】持续治水会消耗粮食、劳力并影响民众承受度。",
      "source_ref_ids": [
        "source-dayu-placeholder"
      ],
      "certainty": "interpretation",
      "teacher_note": ""
    },
    {
      "fact_id": "fact-cooperation",
      "statement": "【教师待审】跨群体协作是样板局势中的关键约束变量。",
      "source_ref_ids": [
        "source-dayu-placeholder"
      ],
      "certainty": "interpretation",
      "teacher_note": ""
    }
  ],
  "source_refs": [
    {
      "source_id": "source-dayu-placeholder",
      "title": "大禹治水样板资料占位",
      "kind": "other",
      "publisher": "",
      "url_or_path": "",
      "citation_note": "教师团队需要在正式发布前替换为教材、课程标准与审校资料。",
      "reliability": "pending"
    }
  ],
  "qa_points": [
    "为什么工程方案会同时改变水患、资源和民心？"
  ],
  "level_goals": [
    "在六回合内控制水患，并保留基本民心、粮食与劳力。"
  ],
  "scenario_refs": [
    {
      "scenario_id": "scenario-dayu-flood-control",
      "scenario_version": 1,
      "checksum": "c35aed9454005e91aa335f754d50c6a94785d49afdf6886f38a5a4e2f8e64911",
      "primary": true
    }
  ],
  "seed_canvas": [],
  "teacher_notes": "所有历史内容均为开发夹具，不承担正式教学结论。",
  "created_at": "2026-07-13T02:00:00Z",
  "updated_at": "2026-07-14T02:00:00Z",
  "sealed_at": "2026-07-14T02:00:00Z",
  "sealed_by": "fixture-builder",
  "checksum": "e128e00b4ad604763bd522be2eca639b3fa00aae878c6dc8a570865350eb6789",
  "compatibility": {
    "kind": "native-v1",
    "source_id": "",
    "source_version": "",
    "source_checksum": null,
    "notes": "",
    "unresolved_refs": [],
    "legacy_materials": [],
    "legacy_id_map": {}
  }
}
